Daniel,Ramírez,23455227,Guatemala,Guatemala,Cuerpos de socorro,21,11/03/2021 08:00:00,3,False
Jose,Alegria,98098798,Guatemala,Guatemala,Otro,70,11/03/2021 08:00:00,4,False
Sebastian,R,42387923214,Guatemala,Guatemala,Trabajador del sector educación,21,11/03/2021 08:00:00,8,False
Adrian,Lopez,4238792321,Guatemala,Guatemala,Trabajador del sector justicia,32,12/03/2021 08:00:00,9,False
Pedro,Lopez,346872111,Guatemala,Guatemala,Trabajador del sector justicia,32,12/03/2021 08:00:00,9,False
Diego,Ramírez,23455234,Guatemala,Guatemala,Trabajador de salud,23,10/03/2021 08:00:00,1,True
Pedro,Alegria,4273864232,Guatemala,Guatemala,Cuidador de adultos mayores,43,10/03/2021 08:00:00,3,True
Miguelito,Elias,3242350,Guatemala,Guatemala,Cuidador de adultos mayores,43,10/03/2021 08:00:00,3,True
